{
  "request_id": "11111111-1111-1111-1111-111111111111",
  "idempotency_key": "run-1:transcribe",
  "contract_version": "1.0",
  "task_type": "audio_transcription",
  "input_schema_version": "1.0",
  "output_schema_version": "1.0",
  "input": { "project_id": "22222222-2222-2222-2222-222222222222" },
  "resource_urls": ["http://minio:9000/private/audio.wav?signature=test"],
  "callback_url": "http://api:8080/v1/provider-callbacks/media/33333333-3333-3333-3333-333333333333",
  "deadline": "2026-07-30T12:10:00Z"
}
